{
  "id": "sample-founder",
  "name": "Sample Name (replace me)",
  "role": "Founder & Program Director",
  "pronouns": "she/her",
  "bio": "Placeholder bio - replace with the real team. Started The Equal Lens after years of running playground workshops, convinced that kids learn fairness best by doing, not by being lectured.",
  "photo": "/team/placeholder.svg",
  "links": { "linkedin": "https://www.linkedin.com/company/the-equal-lens/" },
  "order": 1,
  "placeholder": true
}
